{
  "brief": "A nebula body with drawn drifting clouds and a precise procedural star glint.",
  "palette_intent": "Role body and contour remain visible beneath translucent space art.",
  "motion_intent": "Sixty drawn cloud frames plus an independently timed layer shine.",
  "implementation_hint": "texture",
  "hint_rationale": "The body material is painterly, though the glint may be procedural.",
  "prompt": "Fill the exact pinned blank geometry guide with drifting nebula clouds and a precise star glint: one flat right-facing continuous 16-cell-by-1-cell capsule, one-cell rounded head with a small centered dark core, rounded tail, neutral background, and no gaps, detached plates, perspective, or outside paint. prototype-body-mask-v1 deterministically projects the retained source material through the exact native renderer body mask before review; image_sha256 is the projected authority and source_image_sha256 is audit-only raw provider material.",
  "model_config": "prototype-gemini-3-pro-image-v1",
  "image_sha256": "sha256:4444444444444444444444444444444444444444444444444444444444444444",
  "source_image_sha256": "sha256:8888888888888888888888888888888888888888888888888888888888888888",
  "geometry_projection": "prototype-body-mask-v1",
  "design_guidelines_sha256": "afb9c6cf0a2fcb14bae4e7ff708f20b8064cf3a1efd6c69ef4441de484e1e1ae",
  "prototype_geometry_sha256": "add1b9dbd48f4229d3e85df834ec1fc2666d3ed62e9075d0ddb5d687aa889300",
  "prototype_guide_sha256": "620c98c34f9d4cf0b7366954d48ab964653639d0b5e2a866110093b3de4d19ae"
}
